{
  "protocol_version": "0.1.0",
  "message_type": "CommandResult",
  "command_id": "cmd_execute_action",
  "ok": true,
  "emitted_at": "2026-03-10T00:00:00Z",
  "result": {
    "action_id": "act_goal1234",
    "kind": "record_decision",
    "scope": "branch:alt",
    "scope_label": "Alternative branch",
    "result": {
      "decision_id": "dec_goal1234",
      "scope": "branch:alt",
      "kind": "goal_update"
    }
  }
}
